Key,Faculty,Department,Program,Level,Degree,Course code,Course number,Title,Description,Metadata,Type,Website,Class Units
FAS_846,FAS,Economics,Economics,Graduate,Graduate Diploma,ECON,523 (x-listed w 423),Applied Econometrics,computer analysis; case studies; model building,Courses,Course-integrated,,21.0
FAS_847,FAS,Education,Educational Technology (MA) / Instructional Technology (GDip),Graduate,Master / Graduate Diploma,ETEC,613,Learning Theories,Conduct design sprints to determine a theoretically sound response to a real-world problem of performance and instruction,Courses,Course-integrated,,3.0
FAS_848,FAS,Education,Educational Technology (MA) / Instructional Technology (GDip),Graduate,Master / Graduate Diploma,ETEC,637,Educational Gaming and Modeling,"Given a real-world prompt, design and develop an educational game",Courses,Course-integrated,,18.0
FAS_849,FAS,Education,Educational Technology (MA) / Instructional Technology (GDip),Graduate,Master / Graduate Diploma,ETEC,665,Introduction to Digital Media,Convert real-world documents into learning programs,Courses,Course-integrated,,3.0
FAS_850,FAS,Education,Educational Technology (MA) / Instructional Technology (GDip),Graduate,Master / Graduate Diploma,ETEC,669,Designing and Developing Interactive Instruction,"Given a real-world prompt, design and develop a learning program",Courses,Course-integrated,,3.0
FAS_851,FAS,Education,Educational Technology (MA) / Instructional Technology (GDip),Graduate,Master / Graduate Diploma,ETEC,671,Administering Educational Technology Groups,"Real-world practice of educational technology, experiential learning activities",Courses,Course-integrated,,3.0
FAS_852,FAS,Education,Educational Technology (MA) / Instructional Technology (GDip),Graduate,Master / Graduate Diploma,ETEC,681,Foundations of Distance Education,Real-world projects in educational technology found using the software Riipen.,Courses,Course-integrated,,3.0
FAS_853,FAS,"Geography, Planning and Environment","Human Environment, Environmental Geography, Environmental and Sustainability Science, Minor in Geospatial Technologies",Undergraduate,Bachelor,GEOG,264,Programming for Environmental Sciences,Laboratory,Courses,Course-integrated,,3.0
FAS_854,FAS,"Geography, Planning and Environment","Human Environment, Environmental Geography",Undergraduate,Bachelor,GEOG,323,Urban Agriculture,Field work - working in community gardens,Courses,Course-integrated,,3.0
FAS_855,FAS,"Geography, Planning and Environment","Human Environment, Environmental Geography, Environmental and Sustainability Science, Minor in Geospatial Technologies",Undergraduate,Bachelor,GEOG,464,Programming for Geospatial Technologies,Laboratory,Courses,Course-integrated,,3.0
FAS_856,FAS,"Geography, Planning and Environment","Human Environment, Environmental Geography",Undergraduate,Bachelor,GEOG,490,Internship in Geography,Case study or practicum of 120 hours,Courses,Course-integrated,,3.0
FAS_857,FAS,"Geography, Planning and Environment","PhD (Geography, Urban & Environmental Studies)",Graduate,PhD,HENV,801,Pedagogical Training,Teaching training and in-class practice,Courses,Course-integrated,,3.0
FAS_858,FAS,"Geography, Planning and Environment","Urban Planning, Urban Studies",Undergraduate,Bachelor,URBS,337,Urban Agriculture,Field work - working in community gardens,Courses,Course-integrated,,3.0
FAS_859,FAS,"Geography, Planning and Environment","Urban Planning, Urban Studies",Undergraduate,Bachelor,URBS,362,Quantitative Research Methods,Laboratory,Courses,Course-integrated,,3.0
FAS_860,FAS,"Health, Kinesiology and Applied Physiology",Athletic Therapy,Undergraduate,Bachelor,CATA,365,Athletic Therapy Field Internship I,Internship,Courses,Course-integrated,,3.0
FAS_861,FAS,"Health, Kinesiology and Applied Physiology",Athletic Therapy,Undergraduate,Bachelor,CATA,475,Athletic Therapy Clinical Internship I,Internship,Courses,Course-integrated,,3.0
FAS_862,FAS,"Health, Kinesiology and Applied Physiology",Athletic Therapy,Undergraduate,Bachelor,CATA,485,Athletic Therapy Field Internship II,Internship,Courses,Course-integrated,,3.0
FAS_863,FAS,"Health, Kinesiology and Applied Physiology",Athletic Therapy,Undergraduate,Bachelor,CATA,495,Athletic Therapy Clinical Internship II,Internship,Courses,Course-integrated,,3.0
FAS_864,FAS,"Health, Kinesiology and Applied Physiology",Clinical Exercise Physiology,Undergraduate,Bachelor,KCEP,383,Kinesiology and Clinical Exercise Physiology Internship I,Internship (200 hours),Courses,Course-integrated,,3.0
FAS_865,FAS,"Health, Kinesiology and Applied Physiology",Clinical Exercise Physiology,Undergraduate,Bachelor,KCEP,483,Kinesiology and Clinical Exercise Physiology Internship II,Internship (200 hours),Courses,Course-integrated,,3.0
FAS_866,FAS,School of Irish Studies,Any program,Undergraduate,BA,IRST,299,Selected Topics: Introduction to Spoken Irish,Applied language projects,Courses,Course integrated,,3.0
FAS_867,FAS,School of Irish Studies,Major in Irish Studies,Undergraduate,BA,IRST,300,Research Methods in Irish Studies,Participation in community events followed by anthropological analysis and reflection; final project includes self-driven bibliographic research with primary sources and material objects reflecting on the process in a final reflection paper on the problem or challenge of approaching a topic from at least three disciplinary perspectives. Final presentation could include a performance or creative dimension.,Courses,Course integrated,,3.0
FAS_868,FAS,School of Irish Studies,Any program,Undergraduate,BA,IRST,344,Classics of Irish Theatre,Performance-based activities,Courses,Course integrated,,3.0
FAS_869,FAS,School of Irish Studies,Any program,Undergraduate,BA,IRST,346,Irish Performance Studies,Performance-based activities,Courses,Course integrated,,3.0
FAS_870,FAS,School of Irish Studies,Any program,Undergraduate,BA,IRST,347,Contemporary Irish Theatre,Performance-based activities,Courses,Course integrated,,3.0
FAS_871,FAS,School of Irish Studies,Major in Irish Studies,Undergraduate,BA,IRST,390,Field Studies in Ireland,Self-directed field study,Courses,Course integrated,,3.0
FAS_872,FAS,Liberal Arts College,Liberal Arts,Undergraduate,Bachelor,LBCL,295,History of Art,Museum Field Work Project,,Course-integrated,,3.0
FAS_873,FAS,Loyola College for Diversity and Sustainability,Any program,Undergraduate,Bachelor,LOYC,420,Integrative Project,Most students (about 3/4 of the students) do a hands-on internship of relevance to Sustainability or Diversity Studies in the community and then reflect on their learning through classroom assignments. The rest of the students do a directed-study research project.,Practica,Course-integrated,,6.0
FAS_874,FAS,Mathematics and Statistics,Any program (required in Statistics),Undergraduate,Bachelor,STAT,280,Introduction to Statistical Programming,Introduction to statistical programming and computational statistics using the R programming language.,Courses,Course-integrated,,3.0
FAS_875,FAS,Mathematics and Statistics,Any program (required in Statistics),Undergraduate,Bachelor,STAT,380,Statistical Learning,"Introduction to methods in statistical/machine learning, computer programming, projects using data",Courses,Course-integrated,,3.0
FAS_876,FAS,Mathematics and Statistics,Statistics,Undergraduate,Bachelor,STAT,480,Statistical Consulting and Data Analysis,Statistical software (SAS) projects using data,Courses,Course-integrated,,3.0
FAS_877,FAS,Mathematics and Statistics,Statistics / Actuarial Mathematics / Actuarial Math and Finance/ Mathematical and Computational Finance,Undergraduate,Bachelor,STAT,460,Time Series and Forecasting,Analysis of time series data using statistical software,Courses,Course-integrated,,3.0
FAS_878,FAS,Mathematics and Statistics,Any program,Undergraduate,Bachelor,STAT,497,"Topics in Statistics (Topic in 2020, 2021 - Reinforcement Learning)","Reinforcement Learning - Projects with real world applications, computer programming",Courses,Course-integrated,https://www.concordia.ca/content/dam/artsci/math-stats/docs/Outlines%202021-2022/STAT497_MACF491_MAST679_MAST881_L_2_21.pdf,3.0
FAS_879,FAS,Mathematics and Statistics,Mathematical and Computational Finance,Undergraduate,Bachelor,MACF,401,Mathematical and Computational Finance I,"Modeling financial variables and pricing assets, calibration to real world financial data",Courses,Course-integrated,,6.0
FAS_880,FAS,Mathematics and Statistics,Mathematical and Computational Finance,Undergraduate,Bachelor,MACF,402,Mathematical and Computational Finance I,"Modeling financial variables and pricing assets, calibration to real world data, simulation and other numerical methods",Courses,Course-integrated,,3.0
FAS_881,FAS,Mathematics and Statistics,Mathematics and Statistics / Mathematics and Statistics and Computer Science,Undergraduate,Bachelor,MAST,397,Topics in Mathematics and Statistics (Topic in 2021 - Sports Analytics),"Python programming, analysis of real data related to sports projects",Courses,Course-integrated,https://www.concordia.ca/content/dam/artsci/math-stats/docs/Outlines%202021-2022/MAST397_STAT497_MAST679_N_2_21.pdf,3.0
FAS_882,FAS,Political Science,Political Science,Undergraduate,Bachelor,POLI,397,Internship,"10hrs/week for 13 weeks of relevant work with an employer who trains, supervises and coaches the intern to better understand their field of study. A research paper is graded by a Faculty member. 3 credits.",Practica,Work-integrated,https://www.concordia.ca/content/dam/artsci/polisci/docs/students/POLI397ApplicationFORM.pdf,9.0
FAS_883,FAS,Political science,Political science,Undergraduate,Bachelor,POLI,495,Honours Thesis,,,Course-integrated,,18.0
FAS_884,FAS,Political science,Political science,Graduate,Master,POLI,644,Research Methods,"This course is intended to introduce undergraduate students to quantitative analysis in political science. Key skills in univariate, bivariate, and multivariate analysis; inferential statistics; and graphing are demonstrated using statistical software in lab exercises.",Course,Course-integrated,,18.0
FAS_885,FAS,Political science,Public Policy & Public Administration,Graduate,Master,POLI,683,Mechanics of Briefing Notes,"This course provides students with a thorough understanding of the development and the requirements for writing and presenting policy ideas through government communication vehicles including Question Period notes, Briefing Notes, Memorandums to Cabinet, Treasury Board Submissions, and oral and written presentations to senior management.",Course,Course-integrated,,6.0
FAS_886,FAS,Political science,Public Policy & Public Administration,Graduate,Master,POLI,683,Professional Development,"Students choose from a number of pre-selected workshops, including soft skills, teamwork, leadership, interviewing, communications, French, and data management and analytics, professional ethics, and gender analysis which will help prepare them for their professional careers.",Course,Course-integrated,,12.0
FAS_887,FAS,Political science,Public Policy & Public Administration,Graduate,Master,POLI,683,Minding the Gap,Taught by Public Servant in Residence (current or former) students practice how to prepare and deliver information needed by high level public servants via multiple case studies provided by past and current decision-makers in the Canadian and Quebec governments.,Course,Course-integrated,,3.0
FAS_888,FAS,Political Science,Public Policy & Public Administration,Graduate,Master,POLI,693,Internship,"Students complete 8 public policy stream courses; compete for and attain a relevant paid internship as policy analyst or program evaluator. They complete one 16 week full-time internship, and can extend to 32 weeks.  21 credits divided in Professional Development/Internship/Academic Report.",Practica,Work-integrated,https://www.concordia.ca/artsci/polisci/programs/graduate/mpppa-public-policy-administration/internship.html,3.0
FAS_889,FAS,Political science,Political science,Undergraduate and Graduate,"Bachelor, Master, PhD",POLI,480/685/815,Workshops on Social Science Research Methods,"The Workshops on Social Science Research (WSSR) are short, intensive learning experiences and networking opportunities that allow you to develop your critical thinking skills, make new contacts, and succeed as future decision makers.",Course,Course-integrated,https://www.concordia.ca/artsci/polisci/wssr.html,3.0
FAS_89,FAS,Communication Studies,Communication Studies,Undergraduate,Bachelor,COMS,274,Communication Media: Intermedia I,Practicum course,,Course-integrated,,3.0
FAS_890,FAS,Political science,Political science,Graduate,Master; PhD,POLI,687/812,IPSA-Concordia Summer School in Applied Diplomacy,"Intensive summer school with guest lectures from diplomacy practitioners and academic experts with final assignment a case study completed by team, case studies are policy problems/challenges contributed by diplomacy professionals.",Course,Course-integrated,https://www.concordia.ca/summer/artsci/ipsa-applied-diplomacy.html,3.0
FAS_891,FAS,Physics,Physics,Undergraduate,Bachelor,PHYS,230,Experimental Physics I,"Experiment, lab",Courses,Course-integrated,,3.0
FAS_892,FAS,Physics,Physics,Undergraduate,Bachelor,PHYS,236,Numerical Methods in Physics with Python,includes Programming project,Courses,Course-integrated,,3.0
FAS_893,FAS,Physics,Physics,Undergraduate,Bachelor,PHYS,289,Honours Research Experience I,Research Project,,Course-integrated,,3.0
FAS_894,FAS,Physics,Physics,Undergraduate,Bachelor,PHYS,330,Experimental Physics II,"Experiment, lab",Courses,Course-integrated,,6.0
FAS_895,FAS,Physics,Physics,Undergraduate,Bachelor,PHYS,389,Honours Research Experience II,Research Project,,Course-integrated,,3.0
FAS_896,FAS,Physics,Physics,Undergraduate,Bachelor,PHYS,440,Computational Methods in Physics with Python,includes Programming project,Courses,Course-integrated,,6.0
FAS_897,FAS,Physics,Physics,Undergraduate,Bachelor,PHYS,496,Honours Research Project (6 cr),Final Year Research Project,,Course-integrated,,3.0
FAS_898,FAS,Physics,Physics,Undergraduate,Bachelor,PHYS,497,Specialization Research Project (3 cr),Final Year Research Project,,Course-integrated,,3.0
FAS_899,FAS,Physics,Physics,Graduate,Master,PHYS,760,MSc Seminar on Selected Topics,includes workshops,Courses,Course-integrated,,6.0
FAS_9,FAS,Applied Human Sciences,Human Relations / Community Service,Undergraduate,Bachelor / Certificate,AHSC,425,Organization Development II,"Experiential approaches, in-class applications",Courses,Course-integrated,,3.0
FAS_90,FAS,Communication Studies,Communication Studies,Undergraduate,Bachelor,COMS,276,Communication Media: Sound I,Practicum course,,Course-integrated,,3.0
FAS_900,FAS,Physics,Physics,Graduate,PhD,PHYS,862,Doctoral Seminar on Selected Topics II,includes workshops,Courses,Course-integrated,,6.0
FAS_901,FAS,Physics,Physics,Graduate,Master,PHYS,679*,Computational Methods in Physics with Python,includes Programming project,Courses,Course-integrated,,3.0
FAS_902,FAS,Psychology,Psychology,Undergraduate,Bachelor,PSYC,387,Directed Research in Psychology,"Students work in a research laboratory, gaining experience on current research methods in Psychology",Courses,Course-integrated,,3.0
FAS_903,FAS,Psychology,Psychology,Undergraduate,Bachelor,PSYC,485,Specialization Project,Students work in research lab on thesis. Course trains how to present their projects.,Courses,Course-integrated,,3.0
FAS_904,FAS,Psychology,Psychology,Undergraduate,Bachelor,PSYC,487,Advanced Directed Research in Psychology,"Students work in a research laboratory, gaining experience on current research methods in Psychology. Must have completed PSYC485 or PSYC495.",Courses,Course-integrated,,3.0
FAS_905,FAS,Psychology,Psychology,Undergraduate,Bachelor,PSYC,495,Honours Thesis,Students work in research lab on thesis. Course trains how to present their projects.,Courses,Course-integrated,,3.0
FAS_906,FAS,Psychology,Psychology,Graduate,Master,PSYC,601,Statistical Analysis and Experimental Design,Laboratory,Courses,Course-integrated,,3.0
FAS_907,FAS,Psychology,Psychology,Graduate,PhD,PSYC,823,Multivariate Statistics,Laboratory,Courses,Course-integrated,,3.0
FAS_908,FAS,Religions and Cultures,Religions and Cultures,UG,BA,RELI,210,Religion in Practice,create map of religious sites in students’ neighborhood; interview religious leader for practice portrait; field trips to religious sites,Courses,Course-integrated,,3.0
FAS_909,FAS,Religions and Cultures,Religions and Cultures,UG,BA,RELI,214,Religions of the West,"field trip to places of workshop, creative project, group presentations",Courses,Course-integrated,,3.0
FAS_91,FAS,Communication Studies,Communication Studies,Undergraduate,Bachelor,COMS,284,Communication Media: Moving Images I,Practicum course,,Course-integrated,,3.0
FAS_910,FAS,Religions and Cultures,Religions and Cultures,UG,BA,RELI,215,Religions of Asia,"field trip to places of workshop, creative project, group presentations",Courses,Course-integrated,,3.0
FAS_911,FAS,Religions and Cultures,Religions and Cultures,UG,BA,RELI,220,Introduction to Judaism,"real-life case studies, role-playing, fieldwork, facilitated reflection in response paper assignments",Courses,Course-integrated,,3.0
FAS_912,FAS,Religions and Cultures,Religions and Cultures,UG,BA,RELI,223,Introduction to Christianity,site visits to local churches and Christian communities,Courses,Course-integrated,,3.0
FAS_913,FAS,Religions and Cultures,Religions and Cultures,UG,BA,RELI,224,Introduction to Hinduism,"field trip to places of workshop, creative project, group presentations",Courses,Course-integrated,,3.0
FAS_914,FAS,Religions and Cultures,Religions and Cultures,UG,BA,RELI,312,Justice and Social Conflict in a Globalized World,profile of a social justice organization,Courses,Course-integrated,,3.0
FAS_915,FAS,Religions and Cultures,Religions and Cultures,UG,BA,RELI,313,Zoroastrianism,participation in local community’s gahanbar rituals.,Courses,Course-integrated,,9.0
FAS_916,FAS,Religions and Cultures,Religions and Cultures,UG,BA,RELI,318,Shiite Islam,team video preparation,Courses,Course-integrated,,3.0
FAS_917,FAS,Religions and Cultures,Religions and Cultures,UG,BA,RELI,378,Death and Dying,"profile of death care issues or rituals in Montreal, field trips",Courses,Course-integrated,,3.0
FAS_918,FAS,Religions and Cultures,Religions and Cultures,UG,BA,RELI,387,Goddesses and Religious Images of Women,field report on contemporaneous experience related to course material,Courses,Course-integrated,,3.0
FAS_919,FAS,Religions and Cultures,Religions and Cultures,UG,BA,RELI,390,Angels and Demons in Judaism,"Creative assignment (artwork; poetry; fiction), optional participation in exhibit; in-class presentation",Courses,Course-integrated,,3.0
FAS_92,FAS,Communication Studies,Communication Studies / Communication and Cultural Studies,Undergraduate,Bachelor,COMS,324,Communication Analysis of Environment,"Workshops, Montreal locations site analysis",Courses,Course-integrated,,3.0
FAS_920,FAS,Religions and Cultures,Religions and Cultures,UG,BA,RELI,392,Women in Jewish History: Modern,interviewing a woman whose life story is informative,Courses,Course-integrated,,3.0
FAS_921,FAS,Religions and Cultures,Religions and Cultures,UG,BA,RELI,396,Food and Religion,field report on contemporaneous experience related to course material,Courses,Course-integrated,,3.0
FAS_922,FAS,Religions and Cultures,Religions and Cultures,UG,BA,RELI,409,Methodology and the Study of Religion,"fieldwork project, 2 interviews, site visit to a religious community",Courses,Course-integrated,,3.0
FAS_923,FAS,Religions and Cultures,Religions and Cultures,Graduate,MA,RELI,6007,"Religion, Politics, Heritage","research project based on real world heritage site, data collection, survey, interviewing, ethnographic observation, archival and media research. Presentation and discussion moderation.",Courses,Course-integrated,,3.0
FAS_924,FAS,Religions and Cultures,Religions and Cultures,Graduate,MA JS,RELI,6018,Jewish Community Engagement,internship in local Jewish community organization/institution,Practicum,Course-integrated,,3.0
FAS_925,FAS,Religions and Cultures,Religions and Cultures,Graduate,MA R&C,RELI,6008,Community Engagement,internship in local community organization or institution,Practicum,Course-integrated,,3.0
FAS_926,FAS,School of Community and Public Affairs,Community / Public Affairs and Policy Studies,Undergraduate,Bachelor,SCPA,411,Internship,,Practicum,Work-integrated,,3.0
FAS_927,FAS,School of Community and Public Affairs,Certificate in Immigration Studies,Undergraduate,Certificate,SCPA,482,"Field Project in Immigration, Migration and Diversity",,Courses,Course-integrated,,3.0
FAS_928,FAS,School of Community and Public Affairs,School of Community and Public Affairs,Graduate,Graduate Diploma,SCPA,510,CED Field Project Part 1,,Courses,Course-integrated,,3.0
FAS_929,FAS,Sociology and Anthropology,Sociology,Undergraduate,Bachelor,SOCIANTH,450,Social Economy & Sustainable Futures,Community Service Learning & Group project,Courses,Course-integrated,,3.0
FAS_93,FAS,Communication Studies,Communication Studies,Undergraduate,Bachelor,COMS,361,Propaganda,Projects,Courses,Course-integrated,,3.0
FAS_930,FAS,"Classics, Modern Languages and Linguistics","Classics, Modern Languages and Linguistics",Undergraduate,Bachelor,GERM,200,Introductory German: Intensive,lab work,Course,Course-integrated,,3.0
FAS_931,FAS,"Classics, Modern Languages and Linguistics","Classics, Modern Languages and Linguistics",Undergraduate,Bachelor,ITAL,200,Introductory Italian: Intensive,lab work,Course,Course-integrated,,3.0
FAS_932,FAS,"Classics, Modern Languages and Linguistics","Classics, Modern Languages and Linguistics",Undergraduate,Bachelor,MARA,200,Introduction to Modern Standard Arabic I,lab work,Course,Course-integrated,,3.0
FAS_933,FAS,"Classics, Modern Languages and Linguistics","Classics, Modern Languages and Linguistics",Undergraduate,Bachelor,MCHI,200,Introductory Modern Chinese,lab work,Course,Course-integrated,,3.0
FAS_934,FAS,"Classics, Modern Languages and Linguistics","Classics, Modern Languages and Linguistics",Undergraduate,Bachelor,SPAN,200,Introductory Spanish: Intensive,lab work,Course,Course-integrated,,12.0
FAS_935,FAS,"Classics, Modern Languages and Linguistics","Classics, Modern Languages and Linguistics",Undergraduate,Bachelor,GERM,201,Introductory German I,lab work,Course,Course-integrated,,3.0
FAS_936,FAS,"Classics, Modern Languages and Linguistics","Classics, Modern Languages and Linguistics",Undergraduate,Bachelor,ITAL,201,Introductory Italian I,lab work,Course,Course-integrated,,3.0
FAS_937,FAS,"Classics, Modern Languages and Linguistics","Classics, Modern Languages and Linguistics",Undergraduate,Bachelor,SPAN,201,Introductory Spanish I,lab work,Course,Course-integrated,,3.0
FAS_938,FAS,"Classics, Modern Languages and Linguistics","Classics, Modern Languages and Linguistics",Undergraduate,Bachelor,GERM,202,Introductory German II,lab work,Course,Course-integrated,,3.0
FAS_939,FAS,"Classics, Modern Languages and Linguistics","Classics, Modern Languages and Linguistics",Undergraduate,Bachelor,ITAL,202,Introductory Italian II,lab work,Course,Course-integrated,,3.0
FAS_94,FAS,Communication Studies,Communication Studies,Undergraduate,Bachelor,COMS,374,Communication Media: Intermedia II,Practicum course,,Course-integrated,,3.0
FAS_940,FAS,"Classics, Modern Languages and Linguistics","Classics, Modern Languages and Linguistics",Undergraduate,Bachelor,SPAN,202,Introductory Spanish II,lab work,Course,Course-integrated,,63.0
FAS_941,FAS,"Classics, Modern Languages and Linguistics","Classics, Modern Languages and Linguistics",Undergraduate,Bachelor,MARA,203,Modern Standard Arabic for Heritage Speakers I,lab work,Course,Course-integrated,,63.0
FAS_942,FAS,"Classics, Modern Languages and Linguistics","Classics, Modern Languages and Linguistics",Undergraduate,Bachelor,MARA,206,Introduction to Modern Standard Arabic II,lab work,Course,Course-integrated,,24.0
FAS_943,FAS,"Classics, Modern Languages and Linguistics","Classics, Modern Languages and Linguistics",Undergraduate,Bachelor,MCHI,206,Introduction to Modern Chinese II,lab work,Course,Course-integrated,,3.0
FAS_944,FAS,"Classics, Modern Languages and Linguistics","Classics, Modern Languages and Linguistics",Undergraduate,Bachelor,MARA,207,Modern Standard Arabic for Heritage Speakers II,lab work,Course,Course-integrated,,3.0
FAS_945,FAS,"Classics, Modern Languages and Linguistics","Classics, Modern Languages and Linguistics",Undergraduate,Bachelor,GERM,240,Intermediate German: Intensive Course,lab work,Course,Course-integrated,,3.0
FAS_946,FAS,"Classics, Modern Languages and Linguistics","Classics, Modern Languages and Linguistics",Undergraduate,Bachelor,ITAL,240,Intermediate Italian: Intensive Course,lab work,Course,Course-integrated,,3.0
FAS_947,FAS,"Classics, Modern Languages and Linguistics","Classics, Modern Languages and Linguistics",Undergraduate,Bachelor,MARA,240,Intermediate Modern Standard Arabic I,lab work,Course,Course-integrated,,3.0
FAS_948,FAS,"Classics, Modern Languages and Linguistics","Classics, Modern Languages and Linguistics",Undergraduate,Bachelor,MCHI,240,Intermediate Modern Chinese I,lab work,Course,Course-integrated,,3.0
FAS_949,FAS,"Classics, Modern Languages and Linguistics","Classics, Modern Languages and Linguistics",Undergraduate,Bachelor,SPAN,240,Intermediate Spanish: Intensive Course,lab work,Course,Course-integrated,,3.0
FAS_95,FAS,Communication Studies,Communication Studies,Undergraduate,Bachelor,COMS,376,Communication Media: Sound II,Practicum course,,Course-integrated,,3.0
FAS_950,FAS,"Classics, Modern Languages and Linguistics","Classics, Modern Languages and Linguistics",Undergraduate,Bachelor,MARA,250,Intermediate Modern Standard Arabic I,lab work,Course,Course-integrated,,3.0
